root@lamp-ubuntu-s-1vcpu-1gb-tor1-01:~# tcpdump -c 5 -i eth0
tcpdump: verbose output suppressed, use -v[v]... for full protocol decode
listening on eth0, link-type EN10MB (Ethernet), snapshot length 262144 bytes
22:42:34.428437 IP lamp-ubuntu-s-1vcpu-1gb-tor1-01.ssh > 162.243.190.66.8401: Flags [P.], seq 1367688910:1367689038, ack 451790894, win 502, options [nop,nop,TS val 3455260342 ecr 1927927108], length 128
22:42:34.428497 IP lamp-ubuntu-s-1vcpu-1gb-tor1-01.ssh > 162.243.190.66.8401: Flags [P.], seq 128:192, ack 1, win 502, options [nop,nop,TS val 3455260342 ecr 1927927108], length 64
22:42:34.428547 IP lamp-ubuntu-s-1vcpu-1gb-tor1-01.ssh > 162.243.190.66.8401: Flags [P.], seq 192:272, ack 1, win 502, options [nop,nop,TS val 3455260342 ecr 1927927108], length 80
22:42:34.428595 IP lamp-ubuntu-s-1vcpu-1gb-tor1-01.ssh > 162.243.190.66.8401: Flags [P.], seq 272:352, ack 1, win 502, options [nop,nop,TS val 3455260342 ecr 1927927108], length 80
22:42:34.428641 IP lamp-ubuntu-s-1vcpu-1gb-tor1-01.ssh > 162.243.190.66.8401: Flags [P.], seq 352:432, ack 1, win 502, options [nop,nop,TS val 3455260342 ecr 1927927108], length 80
5 packets captured
35 packets received by filter
0 packets dropped by kernel
